{
  "$schema": "http://json-schema.org/draft-04/schema#",
  "id": "http://justice.gov.uk/listing/event/listing.event.hearing-counsel-modified.json",
  "type": "object",
  "properties": {
    "hearingId": {
      "$ref": "http://justice.gov.uk/core/courts/courtsDefinitions.json#/definitions/uuid"
    },
    "counselType": {
      "type": "string",
      "enum": [
        "PROSECUTION",
        "DEFENCE"
      ]
    },
    "action": {
      "type": "string",
      "enum": [
        "ADD",
        "UPDATE",
        "REMOVE"
      ]
    },
    "payload": {
      "type": "string"
    }
  },
  "required": [
    "hearingId",
    "counselType",
    "action",
    "payload"
  ],
  "additionalProperties": false
}
