{
  "counselType": "DEFENCE",
  "action": "ADD",
  "hearingId": "029034d9-0f54-43c5-ba36-e5deadd62474",
  "payload": "{\"id\":\"fab947a3-c50c-4dbb-accf-b2758b1d2d6d\",\"status\":\"QC\",\"title\":\"Mr\",\"firstName\":\"Eric\",\"lastName\":\"Ormsby\",\"prosecutionCases\":[\"0305de0e-eb0e-478f-8ae4-f2c7966961e3\",\"d06f6539-2a7c-4bc8-bca3-A1e5a225471a\"],\"attendanceDays\":[\"2018-07-17\",\"2018-07-18\",\"2018-07-19\",\"2018-07-21\",\"2018-07-22\"]}"
}
